{
  "schema": "tupper-experiment/v1",
  "width": 106,
  "height": 17,
  "encoding": "column-major-bottom-up",
  "rows": [
    "1110100000000000000000000000000000000000000000000000000000000000000011100111010000000000000000011100000000",
    "1000100000000000000000000000000000000000000000000000000000000000000010000001010000000000000000000100000000",
    "1001000000000000000000000000000000000000000000000000000000000000000010010101001000000000000000000100000111",
    "1001000000100000000000000000000000000000000000000000000000000000000010010101001000000000000000000100000001",
    "1001000001000000000000000000000000000000000000000000000000000000000010100101001000000000000000000100000010",
    "1010000001000000000000000000000000000000000000000000000000000000000010100101000100000000000000000100000100",
    "1010111100000000000000000000000000000000000000000000000000000001111010110101000101110001100101010101000011",
    "1010000100000000000000000000000000000000000000000000000000000000001010000001000101001010010101010100100000",
    "1010001000000000000000000000000000000000000000000000000000000000010010111101000101001010010101010100010111",
    "1010010000010000000101110111010000000000000000000111011100000000100010000001000101110001100010110100100000",
    "1010100100010000001001000001010000000000000000000100000100000001001010001001000101000000000000000101000111",
    "1010011000100000001001000101001000000000000000000100000100000000110010010001000101000000000000000100000010",
    "1001000000100010100001001001001011101110101010000101010100101000000010101001001000000000000000000100000010",
    "1001000000100010100001010101001010101010101010000100100100101000000010101001001000000000000000000100000010",
    "1001000000100100100001010101001011101110011110110101010101001011000010000001001000000000000000000100000011",
    "1000100000010100100001000001010010000000000000000100000101001000000010000001010000000000000000000100000000",
    "1000100000010110100001000001010010000000000000000100000101101000000000000000010000000000000000000100000000"
  ],
  "N": "56525845877585816763039586007520750277353196450595841567735618780688400140898024981743696598491218713015714928398271962117249251816126135758313291996549277852226925632342583919395030421983352656778405325777741906072873874481412543269713885225217255170734791425252274534182128499770100304909062813395973629729728331022409858974448530410675416671693127285242093542682941391314786490816144814610513955188130873521380296068200591469100034890490542735132321279502689903923668808556530273882231399913969596693343635681966013405787571940000044023807",
  "k": "960939379918958884971672962127852754715004339660129306651505519271702802395266424689642842174350718121267153782770623355993237280874144307891325963941337723487857735749823926629715517173716995165232890538221612403238855866184013235585136048828693337902491454229288667081096184496091705183454067827731551705405381627380967602565625016981482083418783163849115590225610003652351370343874461848378737238198224849863465033159410054974700593138339226497249461751545728366702369745461014655997933798537483143786841806593422227898388722980000748404719",
  "canonical": true,
  "display_orientation": "historical",
  "formula_variant": "tupper",
  "formula_latex": "\\frac{1}{2}<\\left\\lfloor\\operatorname{mod}\\left(\\left\\lfloor\\frac{y}{17}\\right\\rfloor2^{-17\\lfloor x\\rfloor-\\operatorname{mod}(\\lfloor y\\rfloor,17)},2\\right)\\right\\rfloor",
  "domain": {
    "x": [
      0,
      106
    ],
    "y_relative_to_k": [
      0,
      17
    ],
    "endpoints": "left-closed-right-open"
  },
  "bitmap_sha256": "429583f1638648eb624720d40c79a10f6dfd5379e7a6a476363543ee6b8a7e00",
  "source": {
    "kind": "published-integer",
    "reference": "R1",
    "locator": "Figure 13, PDF page 7 (printed p.83)",
    "note": "Integer transcribed from paper. Plot regenerated by this repository, not an embedded screenshot."
  },
  "generator": {
    "name": "tupper-formula",
    "version": "1.0.0",
    "python": "3.13.5"
  }
}
